id,context,instruction,display_tokens,answer_words,choices,difficulty,type,full_response
91,I want to join a park cleanup next weekend.,Make an appropriate sentence.,Which groups in ____ ____ ____ ____ ____ ____ ____?,the|city|are|you|planning|to|contact,planning|contact|are|really|to|the|city|you,medium,which_contact,Which groups in the city are you planning to contact?
92,I am exploring literacy volunteer programs.,Make an appropriate sentence.,Which libraries ____ ____ ____ ____ ____ ____ ____?,near|campus|are|you|planning|to|contact,campus|planning|are|really|near|contact|to|you|today,medium,which_contact,Which libraries near campus are you planning to contact?
93,I need a short-term volunteer role for the break.,Make an appropriate sentence.,Which charities ____ ____ ____ ____ ____ ____ ____?,in|town|are|you|planning|to|contact,to|contact|in|you|planning|town|really|are,medium,which_contact,Which charities in town are you planning to contact?
94,I would like to help refugees in the area.,Make an appropriate sentence.,Which centers in ____ ____ ____ ____ ____ ____ ____?,your|city|are|you|planning|to|contact,planning|today|really|are|you|contact|to|city|your,medium,which_contact,Which centers in your city are you planning to contact?
95,I am interested in community garden projects.,Make an appropriate sentence.,Which gardens ____ ____ ____ ____ ____ ____ ____?,near|here|are|you|planning|to|contact,here|planning|really|to|you|near|contact|are|today,medium,which_contact,Which gardens near here are you planning to contact?
96,I want to help at local art events.,Make an appropriate sentence.,Which ____ ____ ____ ____ ____ ____ ____?,organizations|downtown|are|you|planning|to|contact,downtown|really|you|to|organizations|are|contact|planning,medium,which_contact,Which organizations downtown are you planning to contact?
97,I am looking for beach cleanup programs.,Make an appropriate sentence.,Which teams along ____ ____ ____ ____ ____ ____ ____?,the|coast|are|you|planning|to|contact,really|the|planning|you|contact|are|coast|to,medium,which_contact,Which teams along the coast are you planning to contact?
98,I hope to teach basic computer skills.,Make an appropriate sentence.,Which ____ ____ ____ ____ ____ ____ ____?,community|centers|are|you|planning|to|contact,planning|you|community|contact|to|really|today|are|centers,medium,which_contact,Which community centers are you planning to contact?
99,I want to volunteer at a youth sports camp.,Make an appropriate sentence.,Which clubs in ____ ____ ____ ____ ____ ____ ____?,the|area|are|you|planning|to|contact,really|the|to|contact|you|planning|area|are|today,medium,which_contact,Which clubs in the area are you planning to contact?
100,I am searching for animal rescue groups.,Make an appropriate sentence.,Which shelters ____ ____ ____ ____ ____ ____ ____?,near|you|are|you|planning|to|contact,are|to|really|contact|you|today|planning|you|near,medium,which_contact,Which shelters near you are you planning to contact?
101,I saw a few complaints about the payment page.,Make an appropriate sentence.,The supervisor wants to ____ ____ ____ ____ ____ ____ ____.,know|how|we|can|fix|them|promptly,know|fix|we|can|really|today|them|how|promptly,medium,supervisor_wants,The supervisor wants to know how we can fix them promptly.
102,Several students reported errors on the registration site.,Make an appropriate sentence.,The supervisor wants to ____ ____ ____ ____ ____ ____ ____.,know|how|we|can|solve|them|promptly,promptly|them|we|know|can|solve|how|really,medium,supervisor_wants,The supervisor wants to know how we can solve them promptly.
103,Users keep mentioning bugs in the booking system.,Make an appropriate sentence.,The supervisor wants to ____ ____ ____ ____ ____ ____ ____.,know|how|we|can|fix|them|promptly,know|can|really|promptly|fix|we|how|them|today,medium,supervisor_wants,The supervisor wants to know how we can fix them promptly.
104,Customers are confused by the checkout screen.,Make an appropriate sentence.,The supervisor wants to ____ ____ ____ ____ ____ ____ ____.,know|how|we|can|improve|it|quickly,know|quickly|can|how|improve|really|we|it,medium,supervisor_wants,The supervisor wants to know how we can improve it quickly.
105,People said the mobile app keeps crashing.,Make an appropriate sentence.,The supervisor wants to ____ ____ ____ ____ ____ ____ ____.,know|how|we|can|fix|it|promptly,fix|it|really|can|know|how|we|promptly,medium,supervisor_wants,The supervisor wants to know how we can fix it promptly.
106,A few readers complained about broken links.,Make an appropriate sentence.,The supervisor wants to ____ ____ ____ ____ ____ ____ ____.,know|how|we|can|repair|them|quickly,repair|can|really|quickly|how|we|know|them,medium,supervisor_wants,The supervisor wants to know how we can repair them quickly.
107,The support inbox is full of login complaints.,Make an appropriate sentence.,The supervisor wants to ____ ____ ____ ____ ____ ____ ____.,know|how|we|can|address|them|promptly,can|really|them|today|how|know|promptly|address|we,medium,supervisor_wants,The supervisor wants to know how we can address them promptly.
108,Students found mistakes on the course page.,Make an appropriate sentence.,The supervisor wants to ____ ____ ____ ____ ____ ____ ____.,know|how|we|can|correct|them|quickly,today|we|can|know|correct|quickly|how|really|them,medium,supervisor_wants,The supervisor wants to know how we can correct them quickly.
109,The video platform keeps freezing during class.,Make an appropriate sentence.,The supervisor wants to ____ ____ ____ ____ ____ ____ ____.,know|how|we|can|fix|it|promptly,fix|really|how|know|it|promptly|we|can,medium,supervisor_wants,The supervisor wants to know how we can fix it promptly.
110,Clients mentioned delays on the payment screen.,Make an appropriate sentence.,The supervisor wants to ____ ____ ____ ____ ____ ____ ____.,know|how|we|can|reduce|them|quickly,really|can|know|we|today|reduce|how|them|quickly,medium,supervisor_wants,The supervisor wants to know how we can reduce them quickly.
111,Some guests could not open the digital tickets.,Make an appropriate sentence.,The supervisor wants to ____ ____ ____ ____ ____ ____ ____.,know|how|we|can|solve|that|promptly,solve|that|can|really|how|know|promptly|we,medium,supervisor_wants,The supervisor wants to know how we can solve that promptly.
112,The survey form is not saving responses.,Make an appropriate sentence.,The supervisor wants to ____ ____ ____ ____ ____ ____ ____.,know|how|we|can|fix|that|quickly,quickly|today|can|we|how|fix|that|know|really,medium,supervisor_wants,The supervisor wants to know how we can fix that quickly.
113,A few users found typos in the app.,Make an appropriate sentence.,The supervisor wants to ____ ____ ____ ____ ____ ____ ____.,know|how|we|can|correct|them|promptly,how|them|promptly|know|correct|can|really|we,medium,supervisor_wants,The supervisor wants to know how we can correct them promptly.
114,People said the map on the website is wrong.,Make an appropriate sentence.,The supervisor wants to ____ ____ ____ ____ ____ ____ ____.,know|how|we|can|update|it|quickly,how|we|it|can|know|quickly|update|really,medium,supervisor_wants,The supervisor wants to know how we can update it quickly.
115,Several orders were sent to the wrong address.,Make an appropriate sentence.,The supervisor wants to ____ ____ ____ ____ ____ ____ ____.,know|how|we|can|prevent|that|promptly,really|we|know|promptly|how|that|can|prevent,medium,supervisor_wants,The supervisor wants to know how we can prevent that promptly.
116,The new chatbot gave confusing answers.,Make an appropriate sentence.,The supervisor wants to ____ ____ ____ ____ ____ ____ ____.,know|how|we|can|improve|it|quickly,how|can|know|improve|it|quickly|we|today|really,medium,supervisor_wants,The supervisor wants to know how we can improve it quickly.
117,Shoppers reported a problem with coupon codes.,Make an appropriate sentence.,The supervisor wants to ____ ____ ____ ____ ____ ____ ____.,know|how|we|can|fix|that|promptly,can|how|today|really|promptly|know|fix|we|that,medium,supervisor_wants,The supervisor wants to know how we can fix that promptly.
118,Guests said the booking email never arrived.,Make an appropriate sentence.,The supervisor wants to ____ ____ ____ ____ ____ ____ ____.,know|how|we|can|prevent|that|again,know|that|really|we|can|prevent|how|again,medium,supervisor_wants,The supervisor wants to know how we can prevent that again.
119,Readers complained that the newsletter links failed.,Make an appropriate sentence.,The supervisor wants to ____ ____ ____ ____ ____ ____ ____.,know|how|we|can|repair|them|promptly,we|how|know|them|today|can|repair|really|promptly,medium,supervisor_wants,The supervisor wants to know how we can repair them promptly.
120,A few accounts were locked by mistake.,Make an appropriate sentence.,The supervisor wants to ____ ____ ____ ____ ____ ____ ____.,know|how|we|can|address|that|quickly,how|that|really|quickly|can|know|we|address|today,medium,supervisor_wants,The supervisor wants to know how we can address that quickly.
121,Didn't you tell me you lost that document?,Make an appropriate sentence.,I discovered ____ ____ ____ ____ ____ ____ ____.,it|in|the|drawer|near|the|window,the|the|it|window|really|drawer|in|near,medium,found_it,I discovered it in the drawer near the window.
122,Weren't you searching for your notebook?,Make an appropriate sentence.,I found ____ ____ ____ ____ ____ ____ ____.,it|on|the|shelf|by|the|printer,it|the|printer|the|by|on|shelf|really,medium,found_it,I found it on the shelf by the printer.
123,Did you ever locate the missing key card?,Make an appropriate sentence.,I found ____ ____ ____ ____ ____ ____ ____.,it|inside|the|jacket|near|the|door,near|really|door|it|inside|today|jacket|the|the,medium,found_it,I found it inside the jacket near the door.
124,What happened to the conference badge?,Make an appropriate sentence.,I discovered ____ ____ ____ ____ ____ ____ ____.,it|under|the|folder|on|my|desk,today|really|it|on|the|folder|desk|under|my,medium,found_it,I discovered it under the folder on my desk.
125,Did you lose your train pass again?,Make an appropriate sentence.,I found ____ ____ ____ ____ ____ ____ ____.,it|in|the|bag|beside|the|chair,the|really|in|chair|the|bag|it|beside,medium,found_it,I found it in the bag beside the chair.
126,Where was the museum brochure after all?,Make an appropriate sentence.,I found ____ ____ ____ ____ ____ ____ ____.,it|under|the|map|near|the|entrance,the|near|under|map|it|the|really|entrance,medium,found_it,I found it under the map near the entrance.
127,Have you seen your camera battery?,Make an appropriate sentence.,I found ____ ____ ____ ____ ____ ____ ____.,it|inside|the|box|under|the|table,it|table|the|really|under|inside|today|box|the,medium,found_it,I found it inside the box under the table.
128,What about the receipt from the bookstore?,Make an appropriate sentence.,I discovered ____ ____ ____ ____ ____ ____ ____.,it|in|the|pocket|of|my|coat,pocket|it|really|of|the|my|in|coat,medium,found_it,I discovered it in the pocket of my coat.
129,Did you recover the missing flash drive?,Make an appropriate sentence.,I found ____ ____ ____ ____ ____ ____ ____.,it|behind|the|monitor|on|the|desk,it|the|behind|the|desk|monitor|on|really,medium,found_it,I found it behind the monitor on the desk.
130,Where was the apartment contract?,Make an appropriate sentence.,I discovered ____ ____ ____ ____ ____ ____ ____.,it|inside|the|folder|near|the|lamp,the|today|near|the|it|inside|lamp|folder|really,medium,found_it,I discovered it inside the folder near the lamp.
131,What happened to your headphones case?,Make an appropriate sentence.,I found ____ ____ ____ ____ ____ ____ ____.,it|under|the|seat|by|the|window,seat|by|today|it|under|really|the|window|the,medium,found_it,I found it under the seat by the window.
132,Did you find the recipe card eventually?,Make an appropriate sentence.,I discovered ____ ____ ____ ____ ____ ____ ____.,it|in|the|cookbook|on|the|counter,really|cookbook|in|it|the|counter|on|the,medium,found_it,I discovered it in the cookbook on the counter.
133,What about the spare locker key?,Make an appropriate sentence.,I found ____ ____ ____ ____ ____ ____ ____.,it|inside|the|drawer|near|the|mirror,mirror|today|the|really|inside|near|drawer|it|the,medium,found_it,I found it inside the drawer near the mirror.
134,Did the postcard ever turn up?,Make an appropriate sentence.,I discovered ____ ____ ____ ____ ____ ____ ____.,it|under|the|newspaper|by|the|door,it|the|the|newspaper|under|really|by|door,medium,found_it,I discovered it under the newspaper by the door.
135,Were you able to find the lost sketch?,Make an appropriate sentence.,I found ____ ____ ____ ____ ____ ____ ____.,it|inside|the|portfolio|near|the|stairs,it|portfolio|really|inside|the|near|the|stairs,medium,found_it,I found it inside the portfolio near the stairs.
136,What happened to the visitor pass?,Make an appropriate sentence.,I found ____ ____ ____ ____ ____ ____ ____.,it|under|the|clipboard|on|the|table,table|the|on|under|the|really|today|it|clipboard,medium,found_it,I found it under the clipboard on the table.
137,Did you recover that old photo?,Make an appropriate sentence.,I discovered ____ ____ ____ ____ ____ ____ ____.,it|in|the|album|by|the|shelf,really|the|by|it|in|today|the|album|shelf,medium,found_it,I discovered it in the album by the shelf.
138,Where was the missing charger cable?,Make an appropriate sentence.,I found ____ ____ ____ ____ ____ ____ ____.,it|behind|the|sofa|near|the|lamp,sofa|really|behind|the|near|lamp|the|it,medium,found_it,I found it behind the sofa near the lamp.
139,Did anyone find your ID card?,Make an appropriate sentence.,I discovered ____ ____ ____ ____ ____ ____ ____.,it|under|the|binder|on|my|desk,it|under|binder|desk|really|today|on|my|the,medium,found_it,I discovered it under the binder on my desk.
140,What about the draft proposal?,Make an appropriate sentence.,I found ____ ____ ____ ____ ____ ____ ____.,it|inside|the|cabinet|near|the|window,inside|the|it|really|near|the|today|window|cabinet,medium,found_it,I found it inside the cabinet near the window.
141,My next project will be a documentary film about an influential leader.,Make an appropriate sentence.,Have you decided ____ ____ ____ ____ ____ ____ ____?,which|leader|you|want|to|focus|on,on|which|really|focus|to|want|you|leader,medium,decided_focus,Have you decided which leader you want to focus on?
142,Your podcast series about social change sounds ambitious.,Make an appropriate sentence.,Have you decided ____ ____ ____ ____ ____ ____ ____?,which|activist|you|want|to|feature|first,first|activist|you|want|really|which|feature|to|today,medium,decided_focus,Have you decided which activist you want to feature first?
143,That photo essay on urban life could be fascinating.,Make an appropriate sentence.,Have you decided ____ ____ ____ ____ ____ ____ ____?,which|neighborhood|you|want|to|focus|on,really|on|you|want|today|which|focus|neighborhood|to,medium,decided_focus,Have you decided which neighborhood you want to focus on?
144,Your article about renewable energy sounds timely.,Make an appropriate sentence.,Have you decided ____ ____ ____ ____ ____ ____ ____?,which|company|you|want|to|examine|first,you|want|examine|company|today|really|which|first|to,medium,decided_focus,Have you decided which company you want to examine first?
145,The exhibit on local history has lots of possibilities.,Make an appropriate sentence.,Have you decided ____ ____ ____ ____ ____ ____ ____?,which|story|you|want|to|highlight|first,want|first|story|which|to|really|you|highlight,medium,decided_focus,Have you decided which story you want to highlight first?
146,Your video about student life could go in many directions.,Make an appropriate sentence.,Have you decided ____ ____ ____ ____ ____ ____ ____?,which|theme|you|want|to|focus|on,to|really|on|focus|which|theme|want|you,medium,decided_focus,Have you decided which theme you want to focus on?
147,That research project about public transit seems broad.,Make an appropriate sentence.,Have you decided ____ ____ ____ ____ ____ ____ ____?,which|city|you|want|to|study|first,city|really|to|first|you|study|want|which,medium,decided_focus,Have you decided which city you want to study first?
148,Your essay on digital privacy has many examples.,Make an appropriate sentence.,Have you decided ____ ____ ____ ____ ____ ____ ____?,which|case|you|want|to|discuss|first,which|you|case|to|really|want|first|discuss|today,medium,decided_focus,Have you decided which case you want to discuss first?
149,The book report on modern fiction gives you many options.,Make an appropriate sentence.,Have you decided ____ ____ ____ ____ ____ ____ ____?,which|author|you|want|to|analyze|first,today|first|author|really|which|to|want|analyze|you,medium,decided_focus,Have you decided which author you want to analyze first?
150,Your documentary on architecture sounds exciting.,Make an appropriate sentence.,Have you decided ____ ____ ____ ____ ____ ____ ____?,which|building|you|want|to|focus|on,which|to|today|you|want|building|really|on|focus,medium,decided_focus,Have you decided which building you want to focus on?
151,The presentation about marine life needs a clear angle.,Make an appropriate sentence.,Have you decided ____ ____ ____ ____ ____ ____ ____?,which|species|you|want|to|feature|first,want|to|first|which|really|you|species|feature,medium,decided_focus,Have you decided which species you want to feature first?
152,Your poster on public health seems very broad.,Make an appropriate sentence.,Have you decided ____ ____ ____ ____ ____ ____ ____?,which|issue|you|want|to|focus|on,really|you|today|to|issue|on|focus|want|which,medium,decided_focus,Have you decided which issue you want to focus on?
153,That business case study could examine several brands.,Make an appropriate sentence.,Have you decided ____ ____ ____ ____ ____ ____ ____?,which|brand|you|want|to|analyze|first,which|today|really|brand|want|to|analyze|first|you,medium,decided_focus,Have you decided which brand you want to analyze first?
154,Your speech on leadership may need one clear example.,Make an appropriate sentence.,Have you decided ____ ____ ____ ____ ____ ____ ____?,which|person|you|want|to|talk|about,talk|person|about|today|which|you|really|want|to,medium,decided_focus,Have you decided which person you want to talk about?
155,The history project includes many turning points.,Make an appropriate sentence.,Have you decided ____ ____ ____ ____ ____ ____ ____?,which|period|you|want|to|focus|on,focus|on|want|really|period|to|which|you,medium,decided_focus,Have you decided which period you want to focus on?
156,Your art review can compare several painters.,Make an appropriate sentence.,Have you decided ____ ____ ____ ____ ____ ____ ____?,which|artist|you|want|to|discuss|first,you|artist|which|really|first|want|discuss|today|to,medium,decided_focus,Have you decided which artist you want to discuss first?
157,The science article could cover many inventions.,Make an appropriate sentence.,Have you decided ____ ____ ____ ____ ____ ____ ____?,which|invention|you|want|to|highlight|first,highlight|which|invention|want|to|you|really|first,medium,decided_focus,Have you decided which invention you want to highlight first?
158,Your short film about migration has several themes.,Make an appropriate sentence.,Have you decided ____ ____ ____ ____ ____ ____ ____?,which|family|you|want|to|follow|first,really|want|follow|first|to|today|which|family|you,medium,decided_focus,Have you decided which family you want to follow first?
159,The proposal about tourism trends needs a narrow scope.,Make an appropriate sentence.,Have you decided ____ ____ ____ ____ ____ ____ ____?,which|region|you|want|to|focus|on,on|which|want|focus|really|region|to|you,medium,decided_focus,Have you decided which region you want to focus on?
160,Your report on education reform includes many examples.,Make an appropriate sentence.,Have you decided ____ ____ ____ ____ ____ ____ ____?,which|policy|you|want|to|examine|first,to|today|which|want|really|examine|you|first|policy,medium,decided_focus,Have you decided which policy you want to examine first?
161,Why did you move to this neighborhood?,Make an appropriate sentence.,I found the ____ ____ ____ ____ ____ ____ ____.,amenities|in|this|neighborhood|much|more|convenient,neighborhood|convenient|in|this|much|amenities|more|really,medium,reason_found,I found the amenities in this neighborhood much more convenient.
162,Why did you choose that apartment complex?,Make an appropriate sentence.,I found the ____ ____ ____ ____ ____ ____ ____.,location|near|my|office|much|more|convenient,my|much|near|location|convenient|more|office|really,medium,reason_found,I found the location near my office much more convenient.
163,What made you switch to this dorm?,Make an appropriate sentence.,I found ____ ____ ____ ____ ____ ____ ____.,the|shared|kitchen|there|much|more|practical,the|much|kitchen|there|practical|shared|really|more,medium,reason_found,I found the shared kitchen there much more practical.
164,Why did your family move closer to downtown?,Make an appropriate sentence.,I found ____ ____ ____ ____ ____ ____ ____.,the|public|transportation|there|much|more|reliable,transportation|reliable|much|really|the|there|public|more,medium,reason_found,I found the public transportation there much more reliable.
165,Why did you choose the new office building?,Make an appropriate sentence.,I found ____ ____ ____ ____ ____ ____ ____.,the|meeting|spaces|there|much|more|useful,much|useful|more|there|really|spaces|meeting|the,medium,reason_found,I found the meeting spaces there much more useful.
166,Why did you transfer to that campus?,Make an appropriate sentence.,I found ____ ____ ____ ____ ____ ____ ____.,the|course|options|there|much|more|flexible,the|flexible|more|options|today|course|there|really|much,medium,reason_found,I found the course options there much more flexible.
167,Why are you staying in that neighborhood now?,Make an appropriate sentence.,I found the ____ ____ ____ ____ ____ ____ ____.,shops|and|cafés|there|much|more|accessible,accessible|much|there|and|really|today|cafés|more|shops,medium,reason_found,I found the shops and cafés there much more accessible.
168,Why did you rent that studio instead?,Make an appropriate sentence.,I found ____ ____ ____ ____ ____ ____ ____.,the|quiet|street|there|much|more|comfortable,the|there|comfortable|today|much|street|quiet|really|more,medium,reason_found,I found the quiet street there much more comfortable.
169,Why did you move closer to the river?,Make an appropriate sentence.,I found ____ ____ ____ ____ ____ ____ ____.,the|walking|paths|there|much|more|relaxing,paths|more|there|much|the|walking|really|relaxing,medium,reason_found,I found the walking paths there much more relaxing.
170,Why did you choose that coworking space?,Make an appropriate sentence.,I found ____ ____ ____ ____ ____ ____ ____.,the|internet|speed|there|much|more|reliable,speed|there|more|much|internet|the|reliable|really,medium,reason_found,I found the internet speed there much more reliable.
171,Why did you join the gym near the station?,Make an appropriate sentence.,I found ____ ____ ____ ____ ____ ____ ____.,the|class|schedule|there|much|more|convenient,the|class|there|more|convenient|schedule|really|much,medium,reason_found,I found the class schedule there much more convenient.
172,Why did you switch to the newer library branch?,Make an appropriate sentence.,I found ____ ____ ____ ____ ____ ____ ____.,the|study|rooms|there|much|more|available,more|really|rooms|study|available|much|today|the|there,medium,reason_found,I found the study rooms there much more available.
173,Why did you move to the east side?,Make an appropriate sentence.,I found ____ ____ ____ ____ ____ ____ ____.,the|commute|from|there|much|more|manageable,much|commute|from|manageable|there|really|the|more,medium,reason_found,I found the commute from there much more manageable.
174,Why did you change hotels during the trip?,Make an appropriate sentence.,I found the ____ ____ ____ ____ ____ ____ ____.,service|at|this|hotel|much|more|consistent,really|consistent|at|service|today|hotel|this|more|much,medium,reason_found,I found the service at this hotel much more consistent.
175,Why did you pick that café as your workspace?,Make an appropriate sentence.,I ____ ____ ____ ____ ____ ____ ____.,found|the|seating|there|much|more|comfortable,comfortable|found|the|seating|there|much|more|really,medium,reason_found,I found the seating there much more comfortable.
176,Why did you choose the weekend market downtown?,Make an appropriate sentence.,I found ____ ____ ____ ____ ____ ____ ____.,the|local|vendors|there|much|more|interesting,interesting|there|vendors|the|really|much|local|more,medium,reason_found,I found the local vendors there much more interesting.
177,Why did you switch to a different clinic?,Make an appropriate sentence.,I found ____ ____ ____ ____ ____ ____ ____.,the|appointment|system|there|much|more|efficient,there|really|today|the|system|much|more|efficient|appointment,medium,reason_found,I found the appointment system there much more efficient.
178,Why are you studying at that library branch?,Make an appropriate sentence.,I found ____ ____ ____ ____ ____ ____ ____.,the|silent|zone|there|much|more|helpful,helpful|today|silent|the|there|really|more|much|zone,medium,reason_found,I found the silent zone there much more helpful.
179,Why did you choose the smaller theater?,Make an appropriate sentence.,I ____ ____ ____ ____ ____ ____ ____.,found|the|acoustics|there|much|more|impressive,impressive|more|the|really|much|found|there|acoustics,medium,reason_found,I found the acoustics there much more impressive.
