id,context,instruction,display_tokens,answer_words,choices,difficulty,type,full_response
180,Why did you sign up for that program?,Make an appropriate sentence.,I found ____ ____ ____ ____ ____ ____ ____.,the|mentor|support|there|much|more|valuable,valuable|mentor|more|much|support|there|really|the,medium,reason_found,I found the mentor support there much more valuable.
181,The public speaking seminar had many different sessions.,Make an appropriate sentence.,Could you tell ____ ____ ____ ____ ____ ____?,me|how|each|session|was|organized,me|session|really|today|organized|each|was|how,medium,tell_me_how,Could you tell me how each session was organized?
182,The training program looked carefully planned.,Make an appropriate sentence.,Could you tell ____ ____ ____ ____ ____ ____?,me|how|each|workshop|was|structured,really|each|structured|how|today|was|workshop|me,medium,tell_me_how,Could you tell me how each workshop was structured?
183,The conference schedule seemed unusually detailed.,Make an appropriate sentence.,Could you tell ____ ____ ____ ____ ____ ____?,me|how|each|panel|was|organized,really|how|panel|organized|was|each|me,medium,tell_me_how,Could you tell me how each panel was organized?
184,The museum tour included several activity stops.,Make an appropriate sentence.,Could you tell ____ ____ ____ ____ ____ ____?,me|how|each|section|was|planned,section|really|each|me|how|today|planned|was,medium,tell_me_how,Could you tell me how each section was planned?
185,The summer camp offered many afternoon classes.,Make an appropriate sentence.,Could you tell ____ ____ ____ ____ ____ ____?,me|how|each|class|was|organized,was|me|organized|each|class|today|how|really,medium,tell_me_how,Could you tell me how each class was organized?
186,The design sprint had multiple team stages.,Make an appropriate sentence.,Could you tell ____ ____ ____ ____ ____ ____?,me|how|each|stage|was|structured,stage|really|was|structured|me|how|each,medium,tell_me_how,Could you tell me how each stage was structured?
187,The orientation week included many small events.,Make an appropriate sentence.,Could you tell ____ ____ ____ ____ ____ ____?,me|how|each|event|was|arranged,event|really|arranged|me|how|was|each,medium,tell_me_how,Could you tell me how each event was arranged?
188,The debate tournament had a complex schedule.,Make an appropriate sentence.,Could you tell ____ ____ ____ ____ ____ ____?,me|how|each|round|was|organized,was|how|me|organized|each|really|round,medium,tell_me_how,Could you tell me how each round was organized?
189,The exhibition had several themed rooms.,Make an appropriate sentence.,Could you tell ____ ____ ____ ____ ____ ____?,me|how|each|room|was|planned,planned|me|was|how|each|room|really|today,medium,tell_me_how,Could you tell me how each room was planned?
190,The job fair included many company sessions.,Make an appropriate sentence.,Could you tell ____ ____ ____ ____ ____ ____?,me|how|each|booth|was|organized,really|was|how|booth|each|organized|today|me,medium,tell_me_how,Could you tell me how each booth was organized?
191,The writers' workshop had rotating discussions.,Make an appropriate sentence.,Could you tell ____ ____ ____ ____ ____ ____?,me|how|each|group|was|structured,really|group|me|each|how|was|structured,medium,tell_me_how,Could you tell me how each group was structured?
192,The school festival had many performance blocks.,Make an appropriate sentence.,Could you tell ____ ____ ____ ____ ____ ____?,me|how|each|block|was|arranged,how|was|really|each|me|block|arranged,medium,tell_me_how,Could you tell me how each block was arranged?
193,The internship program had several interview steps.,Make an appropriate sentence.,Could you tell ____ ____ ____ ____ ____ ____?,me|how|each|step|was|organized,step|was|really|organized|me|how|each,medium,tell_me_how,Could you tell me how each step was organized?
194,The volunteer training had different learning modules.,Make an appropriate sentence.,Could you tell ____ ____ ____ ____ ____ ____?,me|how|each|module|was|structured,module|structured|each|really|me|was|how,medium,tell_me_how,Could you tell me how each module was structured?
195,The cooking course had weekly skill topics.,Make an appropriate sentence.,Could you tell ____ ____ ____ ____ ____ ____?,me|how|each|lesson|was|planned,really|was|planned|lesson|today|each|me|how,medium,tell_me_how,Could you tell me how each lesson was planned?
196,The startup event offered several mentoring sessions.,Make an appropriate sentence.,Could you tell ____ ____ ____ ____ ____ ____?,me|how|each|session|was|structured,me|really|session|was|today|each|how|structured,medium,tell_me_how,Could you tell me how each session was structured?
197,The language course had many conversation units.,Make an appropriate sentence.,Could you tell ____ ____ ____ ____ ____ ____?,me|how|each|unit|was|organized,how|organized|really|each|was|today|me|unit,medium,tell_me_how,Could you tell me how each unit was organized?
198,The theater workshop used different rehearsal groups.,Make an appropriate sentence.,Could you tell ____ ____ ____ ____ ____ ____?,me|how|each|group|was|arranged,each|arranged|how|really|me|was|group,medium,tell_me_how,Could you tell me how each group was arranged?
199,The reading seminar covered several themes.,Make an appropriate sentence.,Could you tell ____ ____ ____ ____ ____ ____?,me|how|each|theme|was|introduced,introduced|each|was|really|today|how|theme|me,medium,tell_me_how,Could you tell me how each theme was introduced?
200,The leadership retreat had many discussion circles.,Make an appropriate sentence.,Could you tell ____ ____ ____ ____ ____ ____?,me|how|each|circle|was|organized,circle|how|each|me|was|really|organized,medium,tell_me_how,Could you tell me how each circle was organized?
201,The museum closes earlier on weekdays now.,Make an appropriate sentence.,Can you check ____ ____ ____ ____ ____ ____ ____?,what|time|the|ticket|office|closes|today,time|what|ticket|today|really|closes|the|office,medium,check_time,Can you check what time the ticket office closes today?
202,The gallery changed its weekend hours.,Make an appropriate sentence.,Can you check ____ ____ ____ ____ ____ ____ ____?,what|time|the|front|desk|opens|tomorrow,really|front|opens|the|what|desk|tomorrow|time,medium,check_time,Can you check what time the front desk opens tomorrow?
203,The student gym posted a new holiday schedule.,Make an appropriate sentence.,Can you check ____ ____ ____ ____ ____ ____ ____?,what|time|the|fitness|center|closes|tonight,tonight|the|time|what|center|really|closes|fitness,medium,check_time,Can you check what time the fitness center closes tonight?
204,The travel agency opens later on Sundays.,Make an appropriate sentence.,Can you ____ ____ ____ ____ ____ ____ ____?,check|what|time|the|office|opens|today,opens|the|time|check|today|office|really|what,medium,check_time,Can you check what time the office opens today?
205,The bookstore is closing for inventory tonight.,Make an appropriate sentence.,Can you ____ ____ ____ ____ ____ ____ ____?,check|what|time|the|store|closes|today,what|the|closes|store|time|really|today|check,medium,check_time,Can you check what time the store closes today?
206,The language lab has reduced evening hours.,Make an appropriate sentence.,Can you ____ ____ ____ ____ ____ ____ ____?,check|what|time|the|lab|closes|tonight,check|what|closes|the|lab|tonight|really|time,medium,check_time,Can you check what time the lab closes tonight?
207,The café is hosting a private event this afternoon.,Make an appropriate sentence.,Can you ____ ____ ____ ____ ____ ____ ____?,check|what|time|the|counter|reopens|later,counter|reopens|the|time|really|check|later|what,medium,check_time,Can you check what time the counter reopens later?
208,The city pool changed its summer schedule.,Make an appropriate sentence.,Can you ____ ____ ____ ____ ____ ____ ____?,check|what|time|the|pool|opens|tomorrow,tomorrow|time|what|the|pool|opens|check|really,medium,check_time,Can you check what time the pool opens tomorrow?
209,The clinic posted new lunch break hours.,Make an appropriate sentence.,Can you ____ ____ ____ ____ ____ ____ ____?,check|what|time|the|desk|reopens|today,reopens|later|today|what|desk|check|time|the|really,medium,check_time,Can you check what time the desk reopens today?
210,The library has a staff meeting at noon.,Make an appropriate sentence.,Can you check ____ ____ ____ ____ ____ ____ ____?,what|time|the|help|desk|opens|again,time|the|what|desk|really|opens|again|help,medium,check_time,Can you check what time the help desk opens again?
211,The theater box office changed locations.,Make an appropriate sentence.,Can you ____ ____ ____ ____ ____ ____ ____?,check|what|time|the|window|opens|today,time|opens|check|window|today|really|the|what,medium,check_time,Can you check what time the window opens today?
212,The computer lab is closing for cleaning.,Make an appropriate sentence.,Can you ____ ____ ____ ____ ____ ____ ____?,check|what|time|the|lab|reopens|later,reopens|later|the|really|lab|what|time|check,medium,check_time,Can you check what time the lab reopens later?
213,The campus store shortened its Friday hours.,Make an appropriate sentence.,Can you ____ ____ ____ ____ ____ ____ ____?,check|what|time|the|store|closes|today,really|closes|the|today|check|what|store|time|later,medium,check_time,Can you check what time the store closes today?
214,The science center opens late on holidays.,Make an appropriate sentence.,Can you check ____ ____ ____ ____ ____ ____ ____?,what|time|the|main|hall|opens|tomorrow,really|time|what|tomorrow|opens|hall|the|main,medium,check_time,Can you check what time the main hall opens tomorrow?
215,The food court is closing one section for repairs.,Make an appropriate sentence.,Can you check ____ ____ ____ ____ ____ ____ ____?,what|time|the|south|wing|reopens|today,reopens|today|later|time|the|wing|south|really|what,medium,check_time,Can you check what time the south wing reopens today?
216,The visitor center posted a temporary schedule.,Make an appropriate sentence.,Can you ____ ____ ____ ____ ____ ____ ____?,check|what|time|the|center|closes|today,closes|center|the|check|time|really|today|later|what,medium,check_time,Can you check what time the center closes today?
217,The pharmacy in the station changed its hours.,Make an appropriate sentence.,Can you ____ ____ ____ ____ ____ ____ ____?,check|what|time|the|counter|opens|tomorrow,check|opens|counter|the|time|what|really|tomorrow,medium,check_time,Can you check what time the counter opens tomorrow?
218,The archive room now requires appointments.,Make an appropriate sentence.,Can you ____ ____ ____ ____ ____ ____ ____?,check|what|time|the|room|closes|today,check|what|the|time|really|room|closes|today,medium,check_time,Can you check what time the room closes today?
219,The art supply shop is closed for lunch.,Make an appropriate sentence.,Can you ____ ____ ____ ____ ____ ____ ____?,check|what|time|the|shop|reopens|today,really|what|today|the|reopens|time|check|shop,medium,check_time,Can you check what time the shop reopens today?
220,The concert hall opens its doors later on weekends.,Make an appropriate sentence.,Can you ____ ____ ____ ____ ____ ____ ____?,check|what|time|the|hall|opens|tonight,hall|tonight|time|what|check|today|the|opens|really,medium,check_time,Can you check what time the hall opens tonight?
221,Our team meeting felt a little rushed today.,Make an appropriate sentence.,I wonder why ____ ____ ____ ____ ____ ____ ____.,the|manager|changed|the|agenda|so|suddenly,today|agenda|so|the|the|really|changed|suddenly|manager,medium,wonder_why,I wonder why the manager changed the agenda so suddenly.
222,The class discussion ended much earlier than usual.,Make an appropriate sentence.,I wonder why ____ ____ ____ ____ ____ ____ ____.,the|teacher|changed|the|plan|so|quickly,teacher|changed|the|plan|so|today|really|the|quickly,medium,wonder_why,I wonder why the teacher changed the plan so quickly.
223,The museum tour skipped two rooms this morning.,Make an appropriate sentence.,I wonder why ____ ____ ____ ____ ____ ____ ____.,the|guide|changed|the|route|so|suddenly,today|suddenly|the|route|really|so|changed|guide|the,medium,wonder_why,I wonder why the guide changed the route so suddenly.
224,The workshop focused on a different topic today.,Make an appropriate sentence.,I wonder why ____ ____ ____ ____ ____ ____ ____.,the|speaker|changed|the|outline|so|quickly,really|speaker|outline|changed|the|so|the|quickly|today,medium,wonder_why,I wonder why the speaker changed the outline so quickly.
225,The game strategy meeting sounded tense.,Make an appropriate sentence.,I wonder why ____ ____ ____ ____ ____ ____ ____.,the|coach|changed|the|lineup|so|suddenly,changed|coach|so|really|the|the|lineup|suddenly,medium,wonder_why,I wonder why the coach changed the lineup so suddenly.
226,The orientation session moved to another building.,Make an appropriate sentence.,I wonder why ____ ____ ____ ____ ____ ____ ____.,the|staff|changed|the|location|so|quickly,so|quickly|really|location|staff|the|changed|the,medium,wonder_why,I wonder why the staff changed the location so quickly.
227,The conference panel started with a new moderator.,Make an appropriate sentence.,I wonder why ____ ____ ____ ____ ____ ____ ____.,the|organizers|changed|the|schedule|so|suddenly,the|suddenly|really|changed|organizers|so|today|the|schedule,medium,wonder_why,I wonder why the organizers changed the schedule so suddenly.
228,The art class used different materials today.,Make an appropriate sentence.,I wonder why ____ ____ ____ ____ ____ ____ ____.,the|instructor|changed|the|materials|so|quickly,the|materials|quickly|instructor|the|really|changed|so,medium,wonder_why,I wonder why the instructor changed the materials so quickly.
229,The debate team practiced a new format today.,Make an appropriate sentence.,I wonder why ____ ____ ____ ____ ____ ____ ____.,the|captain|changed|the|order|so|suddenly,so|changed|really|the|suddenly|today|captain|the|order,medium,wonder_why,I wonder why the captain changed the order so suddenly.
230,The film screening started without introductions.,Make an appropriate sentence.,I wonder why ____ ____ ____ ____ ____ ____ ____.,the|host|changed|the|program|so|quickly,changed|today|host|quickly|the|really|the|program|so,medium,wonder_why,I wonder why the host changed the program so quickly.
231,The volunteer event began an hour late.,Make an appropriate sentence.,I wonder why ____ ____ ____ ____ ____ ____ ____.,the|coordinator|changed|the|timing|so|suddenly,the|suddenly|so|coordinator|timing|changed|the|really,medium,wonder_why,I wonder why the coordinator changed the timing so suddenly.
232,The training day ended after only one session.,Make an appropriate sentence.,I wonder why ____ ____ ____ ____ ____ ____ ____.,the|director|changed|the|agenda|so|quickly,the|so|agenda|quickly|director|really|changed|the,medium,wonder_why,I wonder why the director changed the agenda so quickly.
233,The interview process has one fewer step now.,Make an appropriate sentence.,I wonder why ____ ____ ____ ____ ____ ____ ____.,the|office|changed|the|process|so|suddenly,process|today|suddenly|really|the|changed|so|the|office,medium,wonder_why,I wonder why the office changed the process so suddenly.
234,The rehearsal used a different ending today.,Make an appropriate sentence.,I wonder why ____ ____ ____ ____ ____ ____ ____.,the|conductor|changed|the|finale|so|quickly,conductor|the|finale|changed|really|the|quickly|so,medium,wonder_why,I wonder why the conductor changed the finale so quickly.
235,The class trip now includes a museum stop.,Make an appropriate sentence.,I wonder why ____ ____ ____ ____ ____ ____ ____.,the|teacher|changed|the|itinerary|so|suddenly,the|itinerary|changed|really|suddenly|teacher|the|so,medium,wonder_why,I wonder why the teacher changed the itinerary so suddenly.
236,The community event moved indoors at noon.,Make an appropriate sentence.,I wonder why ____ ____ ____ ____ ____ ____ ____.,the|team|changed|the|venue|so|quickly,so|team|really|venue|the|quickly|changed|today|the,medium,wonder_why,I wonder why the team changed the venue so quickly.
237,The design review skipped the budget slide.,Make an appropriate sentence.,I wonder why ____ ____ ____ ____ ____ ____ ____.,the|presenter|changed|the|order|so|suddenly,changed|order|really|suddenly|the|so|presenter|the|today,medium,wonder_why,I wonder why the presenter changed the order so suddenly.
238,The study group covered a different chapter today.,Make an appropriate sentence.,I wonder why ____ ____ ____ ____ ____ ____ ____.,the|leader|changed|the|topic|so|quickly,quickly|topic|really|leader|the|so|changed|the,medium,wonder_why,I wonder why the leader changed the topic so quickly.
239,The camp schedule included a new break period.,Make an appropriate sentence.,I wonder why ____ ____ ____ ____ ____ ____ ____.,the|staff|changed|the|routine|so|suddenly,suddenly|really|the|changed|the|routine|staff|so,medium,wonder_why,I wonder why the staff changed the routine so suddenly.
240,The panel discussion added another speaker at noon.,Make an appropriate sentence.,I wonder why ____ ____ ____ ____ ____ ____ ____.,the|committee|changed|the|lineup|so|quickly,changed|lineup|so|quickly|the|really|the|committee,medium,wonder_why,I wonder why the committee changed the lineup so quickly.
241,The travel budget for next month seems too small.,Make an appropriate sentence.,We should ask ____ ____ ____ ____ ____ ____ ____.,whether|the|department|can|increase|it|slightly,whether|really|slightly|the|can|department|increase|it,medium,ask_whether,We should ask whether the department can increase it slightly.
242,The event budget will not cover the new equipment.,Make an appropriate sentence.,We should ask ____ ____ ____ ____ ____ ____ ____.,whether|the|office|can|increase|it|slightly,slightly|the|increase|whether|can|office|really|it,medium,ask_whether,We should ask whether the office can increase it slightly.
243,Our research fund looks too limited this semester.,Make an appropriate sentence.,We should ask ____ ____ ____ ____ ____ ____ ____.,whether|the|committee|can|increase|it|slightly,it|really|the|can|committee|whether|slightly|increase,medium,ask_whether,We should ask whether the committee can increase it slightly.
244,The meal allowance barely covers lunch downtown.,Make an appropriate sentence.,We should ask ____ ____ ____ ____ ____ ____ ____.,whether|the|school|can|raise|it|slightly,can|slightly|whether|really|school|the|raise|it,medium,ask_whether,We should ask whether the school can raise it slightly.
245,The printing budget seems lower than last year.,Make an appropriate sentence.,We should ask ____ ____ ____ ____ ____ ____ ____.,whether|the|manager|can|increase|it|slightly,can|the|it|slightly|increase|manager|really|whether|today,medium,ask_whether,We should ask whether the manager can increase it slightly.
246,The project fund may not cover travel costs.,Make an appropriate sentence.,We should ask ____ ____ ____ ____ ____ ____ ____.,whether|the|team|can|expand|it|slightly,team|it|really|slightly|whether|expand|the|can,medium,ask_whether,We should ask whether the team can expand it slightly.
247,The design grant is smaller than we expected.,Make an appropriate sentence.,We should ask ____ ____ ____ ____ ____ ____ ____.,whether|the|board|can|increase|it|slightly,really|slightly|today|the|whether|increase|it|can|board,medium,ask_whether,We should ask whether the board can increase it slightly.
248,The scholarship amount will not cover housing.,Make an appropriate sentence.,We should ask ____ ____ ____ ____ ____ ____ ____.,whether|the|program|can|raise|it|slightly,today|slightly|whether|raise|can|it|the|really|program,medium,ask_whether,We should ask whether the program can raise it slightly.
249,The festival budget seems tight for advertising.,Make an appropriate sentence.,We should ask ____ ____ ____ ____ ____ ____ ____.,whether|the|sponsors|can|increase|it|slightly,increase|the|whether|really|sponsors|can|it|slightly,medium,ask_whether,We should ask whether the sponsors can increase it slightly.
250,The class trip fund will not cover the bus fee.,Make an appropriate sentence.,We should ask ____ ____ ____ ____ ____ ____ ____.,whether|the|school|can|increase|it|slightly,it|can|slightly|increase|the|school|whether|really|today,medium,ask_whether,We should ask whether the school can increase it slightly.
251,The training budget is too low for materials.,Make an appropriate sentence.,We should ask ____ ____ ____ ____ ____ ____ ____.,whether|the|office|can|raise|it|slightly,raise|it|the|can|slightly|office|whether|really|today,medium,ask_whether,We should ask whether the office can raise it slightly.
252,The club budget looks smaller this term.,Make an appropriate sentence.,We should ask ____ ____ ____ ____ ____ ____ ____.,whether|the|advisor|can|increase|it|slightly,increase|advisor|really|the|today|can|it|whether|slightly,medium,ask_whether,We should ask whether the advisor can increase it slightly.
253,The equipment fund seems short by a little.,Make an appropriate sentence.,We should ask ____ ____ ____ ____ ____ ____ ____.,whether|the|lab|can|increase|it|slightly,really|lab|it|the|today|whether|increase|can|slightly,medium,ask_whether,We should ask whether the lab can increase it slightly.
254,The exhibition budget will not cover framing costs.,Make an appropriate sentence.,We should ask ____ ____ ____ ____ ____ ____ ____.,whether|the|museum|can|expand|it|slightly,it|expand|can|whether|really|museum|slightly|the,medium,ask_whether,We should ask whether the museum can expand it slightly.
255,The outreach budget is too low for flyers.,Make an appropriate sentence.,We should ask ____ ____ ____ ____ ____ ____ ____.,whether|the|department|can|raise|it|slightly,it|today|raise|the|department|really|whether|can|slightly,medium,ask_whether,We should ask whether the department can raise it slightly.
256,Our workshop fund may not cover guest speakers.,Make an appropriate sentence.,We should ask ____ ____ ____ ____ ____ ____ ____.,whether|the|committee|can|increase|it|slightly,increase|whether|it|the|today|slightly|can|really|committee,medium,ask_whether,We should ask whether the committee can increase it slightly.
257,The volunteer program needs a bit more money.,Make an appropriate sentence.,We should ask ____ ____ ____ ____ ____ ____ ____.,whether|the|office|can|expand|it|slightly,it|can|expand|office|slightly|really|whether|the,medium,ask_whether,We should ask whether the office can expand it slightly.
258,The maintenance fund seems too small this year.,Make an appropriate sentence.,We should ask ____ ____ ____ ____ ____ ____ ____.,whether|the|city|can|increase|it|slightly,the|can|increase|slightly|it|really|whether|today|city,medium,ask_whether,We should ask whether the city can increase it slightly.
259,The contest budget cannot cover all the prizes.,Make an appropriate sentence.,We should ask ____ ____ ____ ____ ____ ____ ____.,whether|the|organizers|can|raise|it|slightly,it|raise|slightly|really|can|the|today|organizers|whether,medium,ask_whether,We should ask whether the organizers can raise it slightly.
260,The publication budget is too small for color pages.,Make an appropriate sentence.,We should ask ____ ____ ____ ____ ____ ____ ____.,whether|the|editor|can|increase|it|slightly,today|can|slightly|the|it|increase|really|whether|editor,medium,ask_whether,We should ask whether the editor can increase it slightly.
261,The new app tutorial was confusing.,Make an appropriate sentence.,I could not figure ____ ____ ____ ____ ____ ____ ____.,out|where|the|settings|menu|was|located,located|settings|the|where|menu|out|was|really|today,medium,could_not_figure,I could not figure out where the settings menu was located.
262,The website instructions were too vague.,Make an appropriate sentence.,I could not figure ____ ____ ____ ____ ____ ____ ____.,out|where|the|download|button|was|located,located|out|where|button|today|really|was|the|download,medium,could_not_figure,I could not figure out where the download button was located.
263,The registration form changed its layout.,Make an appropriate sentence.,I could not figure ____ ____ ____ ____ ____ ____ ____.,out|where|the|submit|link|was|located,the|located|link|really|out|submit|where|today|was,medium,could_not_figure,I could not figure out where the submit link was located.
264,The smart TV menu was hard to navigate.,Make an appropriate sentence.,I could not figure ____ ____ ____ ____ ____ ____ ____.,out|where|the|search|icon|was|located,out|the|where|was|search|really|located|icon|today,medium,could_not_figure,I could not figure out where the search icon was located.
265,The museum app looked different after the update.,Make an appropriate sentence.,I could not figure ____ ____ ____ ____ ____ ____ ____.,out|where|the|audio|guide|was|located,out|where|the|today|located|audio|guide|was|really,medium,could_not_figure,I could not figure out where the audio guide was located.
266,The travel site redesigned its payment page.,Make an appropriate sentence.,I could not figure ____ ____ ____ ____ ____ ____ ____.,out|where|the|coupon|box|was|located,located|where|the|really|coupon|was|box|out|today,medium,could_not_figure,I could not figure out where the coupon box was located.
267,The campus portal moved a few options around.,Make an appropriate sentence.,I could not figure ____ ____ ____ ____ ____ ____ ____.,out|where|the|grade|tab|was|located,really|where|located|was|tab|grade|the|out,medium,could_not_figure,I could not figure out where the grade tab was located.
