id,context,instruction,display_tokens,answer_words,choices,difficulty,type,full_response
1,The new restaurant downtown looks busy already.,Make an appropriate sentence.,Do you ____ ____ ____ ____ ____ ____ ____?,know|if|it|is|taking|reservations|today,reservations|if|know|taking|it|today|is|really,medium,indirect_question_if,Do you know if it is taking reservations today?
2,That café near campus is always full at lunch.,Make an appropriate sentence.,Do you ____ ____ ____ ____ ____ ____ ____?,know|if|it|is|taking|walk-ins|today,it|today|know|taking|if|walk-ins|is|really,medium,indirect_question_if,Do you know if it is taking walk-ins today?
3,The bookstore website says the author event may sell out.,Make an appropriate sentence.,Do you know ____ ____ ____ ____ ____ ____ ____?,if|it|is|offering|extra|seats|tonight,if|really|tonight|extra|is|it|seats|offering,medium,indirect_question_if,Do you know if it is offering extra seats tonight?
4,The clinic opened a new appointment page this week.,Make an appropriate sentence.,Do you know ____ ____ ____ ____ ____ ____ ____?,if|it|is|accepting|new|patients|now,patients|new|is|now|if|accepting|really|it,medium,indirect_question_if,Do you know if it is accepting new patients now?
5,That photography workshop became popular overnight.,Make an appropriate sentence.,Do you know ____ ____ ____ ____ ____ ____ ____?,if|it|is|adding|another|session|soon,if|another|soon|really|adding|session|it|is,medium,indirect_question_if,Do you know if it is adding another session soon?
6,The student center gym reopened this morning.,Make an appropriate sentence.,Do you know ____ ____ ____ ____ ____ ____ ____?,if|it|is|allowing|guest|passes|today,it|is|really|if|guest|allowing|passes|today,medium,indirect_question_if,Do you know if it is allowing guest passes today?
7,The pottery studio looks packed this afternoon.,Make an appropriate sentence.,Do you ____ ____ ____ ____ ____ ____ ____?,know|if|it|is|taking|drop-ins|today,taking|drop-ins|if|it|today|really|know|is,medium,indirect_question_if,Do you know if it is taking drop-ins today?
8,The language lab introduced a tutoring schedule.,Make an appropriate sentence.,Do you know ____ ____ ____ ____ ____ ____ ____?,if|it|is|posting|available|times|online,if|times|is|posting|it|available|really|online|today,medium,indirect_question_if,Do you know if it is posting available times online?
9,The shuttle service changed its route this week.,Make an appropriate sentence.,Do you know if ____ ____ ____ ____ ____ ____ ____?,it|is|stopping|near|the|library|now,library|near|really|now|the|it|is|stopping,medium,indirect_question_if,Do you know if it is stopping near the library now?
10,The local theater announced discounted tickets.,Make an appropriate sentence.,Do you know ____ ____ ____ ____ ____ ____ ____?,if|it|is|selling|student|tickets|today,is|selling|tickets|if|today|student|really|it,medium,indirect_question_if,Do you know if it is selling student tickets today?
11,The neighborhood pool is open again.,Make an appropriate sentence.,Do you know if ____ ____ ____ ____ ____ ____ ____?,it|is|offering|swim|lessons|this|month,offering|really|lessons|is|month|this|it|swim,medium,indirect_question_if,Do you know if it is offering swim lessons this month?
12,The career center launched a new booking portal.,Make an appropriate sentence.,Do you know ____ ____ ____ ____ ____ ____ ____?,if|it|is|showing|interview|slots|yet,it|yet|really|is|showing|today|interview|if|slots,medium,indirect_question_if,Do you know if it is showing interview slots yet?
13,The hotel restaurant added a brunch menu.,Make an appropriate sentence.,Do you know ____ ____ ____ ____ ____ ____ ____?,if|it|is|serving|weekend|specials|already,weekend|it|already|is|if|specials|serving|today|really,medium,indirect_question_if,Do you know if it is serving weekend specials already?
14,The bike shop reopened after the renovation.,Make an appropriate sentence.,Do you ____ ____ ____ ____ ____ ____ ____?,know|if|it|is|renting|helmets|again,helmets|it|if|know|again|really|is|renting,medium,indirect_question_if,Do you know if it is renting helmets again?
15,The museum posted a notice about late entry.,Make an appropriate sentence.,Do you know if ____ ____ ____ ____ ____ ____ ____?,it|is|allowing|visitors|after|six|today,it|visitors|today|after|really|is|allowing|six,medium,indirect_question_if,Do you know if it is allowing visitors after six today?
16,The bakery released a holiday preorder form.,Make an appropriate sentence.,Do you know ____ ____ ____ ____ ____ ____ ____?,if|it|is|taking|cake|orders|now,it|really|orders|now|if|cake|taking|is,medium,indirect_question_if,Do you know if it is taking cake orders now?
17,The research lab opened a sign-up page.,Make an appropriate sentence.,Do you know if ____ ____ ____ ____ ____ ____ ____?,it|is|accepting|new|assistants|this|term,new|really|assistants|is|it|term|accepting|this,medium,indirect_question_if,Do you know if it is accepting new assistants this term?
18,The public library changed its event system.,Make an appropriate sentence.,Do you know ____ ____ ____ ____ ____ ____ ____?,if|it|is|using|digital|tickets|now,now|today|is|tickets|really|digital|using|if|it,medium,indirect_question_if,Do you know if it is using digital tickets now?
19,The campus clinic is short-staffed this week.,Make an appropriate sentence.,Do you know ____ ____ ____ ____ ____ ____ ____?,if|it|is|rescheduling|morning|appointments|today,really|if|is|today|it|rescheduling|appointments|morning,medium,indirect_question_if,Do you know if it is rescheduling morning appointments today?
20,The conference desk moved to another hall.,Make an appropriate sentence.,Do you know ____ ____ ____ ____ ____ ____ ____?,if|it|is|printing|name|badges|there,really|there|printing|today|it|if|name|is|badges,medium,indirect_question_if,Do you know if it is printing name badges there?
21,That lecture on climate policy was harder than I expected.,Make an appropriate sentence.,I did ____ ____ ____ ____ ____ ____ ____.,not|get|what|the|professor|meant|either,really|meant|not|professor|today|get|either|what|the,medium,did_not_get,I did not get what the professor meant either.
22,The advisor's email about graduation was confusing.,Make an appropriate sentence.,I ____ ____ ____ ____ ____ ____ ____.,did|not|get|what|she|meant|either,what|really|not|either|today|get|meant|did|she,medium,did_not_get,I did not get what she meant either.
23,The safety announcement before the lab was unclear.,Make an appropriate sentence.,I did ____ ____ ____ ____ ____ ____ ____.,not|get|what|the|speaker|meant|either,not|what|meant|really|either|speaker|the|get,medium,did_not_get,I did not get what the speaker meant either.
24,That comment during the workshop sounded vague.,Make an appropriate sentence.,I did ____ ____ ____ ____ ____ ____ ____.,not|get|what|the|presenter|meant|either,get|really|not|today|meant|either|presenter|what|the,medium,did_not_get,I did not get what the presenter meant either.
25,The manager's explanation of the policy was too fast.,Make an appropriate sentence.,I ____ ____ ____ ____ ____ ____ ____.,did|not|get|what|he|meant|either,did|get|really|not|meant|either|what|today|he,medium,did_not_get,I did not get what he meant either.
26,The discussion about the budget was full of jargon.,Make an appropriate sentence.,I ____ ____ ____ ____ ____ ____ ____.,did|not|get|what|they|meant|either,really|they|get|either|what|today|meant|did|not,medium,did_not_get,I did not get what they meant either.
27,The judge's feedback after the contest confused me.,Make an appropriate sentence.,I ____ ____ ____ ____ ____ ____ ____.,did|not|get|what|she|meant|either,either|what|get|she|did|meant|really|not,medium,did_not_get,I did not get what she meant either.
28,That message in the group chat was not very clear.,Make an appropriate sentence.,I ____ ____ ____ ____ ____ ____ ____.,did|not|get|what|he|meant|either,he|get|today|did|meant|not|really|either|what,medium,did_not_get,I did not get what he meant either.
29,The museum guide used a lot of technical words.,Make an appropriate sentence.,I did ____ ____ ____ ____ ____ ____ ____.,not|get|what|the|guide|meant|either,guide|either|meant|not|the|get|today|what|really,medium,did_not_get,I did not get what the guide meant either.
30,The engineer's answer in the Q&A was complicated.,Make an appropriate sentence.,I ____ ____ ____ ____ ____ ____ ____.,did|not|get|what|she|meant|either,today|not|meant|she|did|really|what|get|either,medium,did_not_get,I did not get what she meant either.
31,That line in the article sounded ambiguous.,Make an appropriate sentence.,I did ____ ____ ____ ____ ____ ____ ____.,not|get|what|the|writer|meant|either,get|the|writer|meant|not|what|either|really|today,medium,did_not_get,I did not get what the writer meant either.
32,The coach's instructions before the match were rushed.,Make an appropriate sentence.,I ____ ____ ____ ____ ____ ____ ____.,did|not|get|what|he|meant|either,meant|did|not|get|either|what|he|really,medium,did_not_get,I did not get what he meant either.
33,The training video skipped an important step.,Make an appropriate sentence.,I did ____ ____ ____ ____ ____ ____ ____.,not|get|what|the|narrator|meant|either,narrator|either|get|meant|the|what|really|not|today,medium,did_not_get,I did not get what the narrator meant either.
34,The professor's joke during class went over my head.,Make an appropriate sentence.,I ____ ____ ____ ____ ____ ____ ____.,did|not|get|what|she|meant|either,really|today|not|she|get|meant|either|what|did,medium,did_not_get,I did not get what she meant either.
35,The announcement about the room change was strange.,Make an appropriate sentence.,I ____ ____ ____ ____ ____ ____ ____.,did|not|get|what|they|meant|either,they|either|not|did|get|what|meant|really,medium,did_not_get,I did not get what they meant either.
36,The curator's description of the painting was abstract.,Make an appropriate sentence.,I did ____ ____ ____ ____ ____ ____ ____.,not|get|what|the|curator|meant|either,meant|really|get|the|either|not|curator|today|what,medium,did_not_get,I did not get what the curator meant either.
37,The editor's note on my essay was too short.,Make an appropriate sentence.,I ____ ____ ____ ____ ____ ____ ____.,did|not|get|what|she|meant|either,either|get|did|today|meant|she|really|not|what,medium,did_not_get,I did not get what she meant either.
38,The host's introduction before the panel was vague.,Make an appropriate sentence.,I ____ ____ ____ ____ ____ ____ ____.,did|not|get|what|he|meant|either,not|really|did|get|he|today|meant|either|what,medium,did_not_get,I did not get what he meant either.
39,That sentence in the reading passage was tricky.,Make an appropriate sentence.,I did ____ ____ ____ ____ ____ ____ ____.,not|get|what|the|author|meant|either,get|either|author|really|the|meant|what|not,medium,did_not_get,I did not get what the author meant either.
40,The team leader's instructions after lunch were unclear.,Make an appropriate sentence.,I ____ ____ ____ ____ ____ ____ ____.,did|not|get|what|she|meant|either,she|get|meant|really|not|what|did|either,medium,did_not_get,I did not get what she meant either.
41,Have you thought about buying stock in that startup?,Make an appropriate sentence.,I am ____ ____ ____ ____ ____ ____.,not|comfortable|with|investments|like|that,like|investments|with|today|really|not|comfortable|that,medium,not_comfortable,I am not comfortable with investments like that.
42,Would you invest in a brand-new company?,Make an appropriate sentence.,I am ____ ____ ____ ____ ____ ____.,not|comfortable|with|risks|like|that,with|that|like|really|not|comfortable|risks,medium,not_comfortable,I am not comfortable with risks like that.
43,Some people buy cryptocurrency without much research.,Make an appropriate sentence.,I am ____ ____ ____ ____ ____ ____.,not|comfortable|with|choices|like|that,today|really|choices|comfortable|like|not|with|that,medium,not_comfortable,I am not comfortable with choices like that.
44,My cousin wants to put all his savings into one fund.,Make an appropriate sentence.,I am ____ ____ ____ ____ ____ ____.,not|comfortable|with|plans|like|that,like|comfortable|really|not|plans|today|that|with,medium,not_comfortable,I am not comfortable with plans like that.
45,The ad makes day trading sound easy.,Make an appropriate sentence.,I am ____ ____ ____ ____ ____ ____.,not|comfortable|with|strategies|like|that,like|not|that|comfortable|strategies|really|today|with,medium,not_comfortable,I am not comfortable with strategies like that.
46,My friend wants to borrow money to invest.,Make an appropriate sentence.,I am ____ ____ ____ ____ ____ ____.,not|comfortable|with|moves|like|that,that|like|comfortable|not|today|really|with|moves,medium,not_comfortable,I am not comfortable with moves like that.
47,They suggested buying shares based on a rumor.,Make an appropriate sentence.,I am ____ ____ ____ ____ ____ ____.,not|comfortable|with|advice|like|that,not|like|today|advice|comfortable|with|that|really,medium,not_comfortable,I am not comfortable with advice like that.
48,He wants to invest in a business he barely knows.,Make an appropriate sentence.,I am ____ ____ ____ ____ ____ ____.,not|comfortable|with|decisions|like|that,comfortable|really|that|like|not|decisions|with,medium,not_comfortable,I am not comfortable with decisions like that.
49,She plans to buy a lot of stock all at once.,Make an appropriate sentence.,I am ____ ____ ____ ____ ____ ____.,not|comfortable|with|purchases|like|that,like|with|purchases|comfortable|that|not|really,medium,not_comfortable,I am not comfortable with purchases like that.
50,The app keeps recommending risky assets.,Make an appropriate sentence.,I am ____ ____ ____ ____ ____ ____.,not|comfortable|with|suggestions|like|that,that|today|with|not|really|like|suggestions|comfortable,medium,not_comfortable,I am not comfortable with suggestions like that.
51,Someone online told me to buy a coin tonight.,Make an appropriate sentence.,I am ____ ____ ____ ____ ____ ____.,not|comfortable|with|tips|like|that,really|today|not|tips|like|that|comfortable|with,medium,not_comfortable,I am not comfortable with tips like that.
52,My brother wants to invest without reading the report.,Make an appropriate sentence.,I am ____ ____ ____ ____ ____ ____.,not|comfortable|with|habits|like|that,like|really|habits|comfortable|not|with|that|today,medium,not_comfortable,I am not comfortable with habits like that.
53,They are asking for money before sharing details.,Make an appropriate sentence.,I am ____ ____ ____ ____ ____ ____.,not|comfortable|with|offers|like|that,offers|comfortable|like|that|with|not|really,medium,not_comfortable,I am not comfortable with offers like that.
54,A coworker said I should follow every market trend.,Make an appropriate sentence.,I am ____ ____ ____ ____ ____ ____.,not|comfortable|with|approaches|like|that,with|comfortable|really|approaches|like|not|today|that,medium,not_comfortable,I am not comfortable with approaches like that.
55,The sales pitch sounded too good to be true.,Make an appropriate sentence.,I am ____ ____ ____ ____ ____ ____.,not|comfortable|with|promises|like|that,that|promises|comfortable|with|really|like|not,medium,not_comfortable,I am not comfortable with promises like that.
56,She wants to sign the contract right away.,Make an appropriate sentence.,I am ____ ____ ____ ____ ____ ____.,not|comfortable|with|agreements|like|that,with|that|not|comfortable|like|agreements|really,medium,not_comfortable,I am not comfortable with agreements like that.
57,The website asked for payment before any explanation.,Make an appropriate sentence.,I am ____ ____ ____ ____ ____ ____.,not|comfortable|with|requests|like|that,that|comfortable|like|requests|really|not|today|with,medium,not_comfortable,I am not comfortable with requests like that.
58,He plans to make the purchase without testing the product.,Make an appropriate sentence.,I am ____ ____ ____ ____ ____ ____.,not|comfortable|with|actions|like|that,really|with|actions|that|not|comfortable|like,medium,not_comfortable,I am not comfortable with actions like that.
59,They want to share private data for a small reward.,Make an appropriate sentence.,I am ____ ____ ____ ____ ____ ____.,not|comfortable|with|deals|like|that,comfortable|like|not|really|with|deals|that,medium,not_comfortable,I am not comfortable with deals like that.
60,The proposal seems rushed and incomplete.,Make an appropriate sentence.,I am ____ ____ ____ ____ ____ ____.,not|comfortable|with|arrangements|like|that,comfortable|arrangements|like|not|really|with|that,medium,not_comfortable,I am not comfortable with arrangements like that.
61,That jazz concert last Friday was really amazing.,Make an appropriate sentence.,How can we find out ____ ____ ____ ____ ____ ____ ____?,when|a|similar|event|is|happening|again,when|again|happening|a|similar|really|event|is,medium,find_out_when,How can we find out when a similar event is happening again?
62,The food festival downtown was so much fun.,Make an appropriate sentence.,How can we find ____ ____ ____ ____ ____ ____ ____?,out|when|another|festival|is|coming|back,festival|when|coming|really|another|back|out|is,medium,find_out_when,How can we find out when another festival is coming back?
63,I loved the guest lecture in the main hall.,Make an appropriate sentence.,How can we find ____ ____ ____ ____ ____ ____ ____?,out|when|that|speaker|is|visiting|again,out|when|that|visiting|today|really|again|speaker|is,medium,find_out_when,How can we find out when that speaker is visiting again?
64,The science museum's night tour was excellent.,Make an appropriate sentence.,How can we find ____ ____ ____ ____ ____ ____ ____?,out|when|the|next|tour|is|scheduled,is|out|next|scheduled|tour|the|really|when,medium,find_out_when,How can we find out when the next tour is scheduled?
65,That photography exhibit was worth the trip.,Make an appropriate sentence.,How can we find out ____ ____ ____ ____ ____ ____ ____?,when|a|new|show|is|opening|there,opening|is|new|a|there|really|show|today|when,medium,find_out_when,How can we find out when a new show is opening there?
66,The dance performance last month sold out quickly.,Make an appropriate sentence.,How can we find ____ ____ ____ ____ ____ ____ ____?,out|when|another|performance|is|planned|soon,is|really|out|when|performance|another|planned|soon,medium,find_out_when,How can we find out when another performance is planned soon?
67,The school orchestra played beautifully yesterday.,Make an appropriate sentence.,How can we find out ____ ____ ____ ____ ____ ____ ____?,when|their|next|concert|is|taking|place,when|place|concert|next|really|their|taking|is,medium,find_out_when,How can we find out when their next concert is taking place?
68,The cooking class filled up before I could register.,Make an appropriate sentence.,How can we find out ____ ____ ____ ____ ____ ____ ____?,when|the|next|class|is|being|offered,the|next|class|when|being|is|really|offered,medium,find_out_when,How can we find out when the next class is being offered?
69,The beach cleanup event felt rewarding.,Make an appropriate sentence.,How can we find out ____ ____ ____ ____ ____ ____ ____?,when|the|next|cleanup|is|happening|nearby,cleanup|nearby|really|the|next|when|happening|is,medium,find_out_when,How can we find out when the next cleanup is happening nearby?
70,The startup fair had great networking sessions.,Make an appropriate sentence.,How can we find out ____ ____ ____ ____ ____ ____ ____?,when|a|similar|fair|is|happening|again,again|when|happening|similar|really|today|is|a|fair,medium,find_out_when,How can we find out when a similar fair is happening again?
71,That book signing at the library was crowded.,Make an appropriate sentence.,How can we find out ____ ____ ____ ____ ____ ____ ____?,when|the|author|is|coming|back|again,coming|really|again|is|when|author|the|back,medium,find_out_when,How can we find out when the author is coming back again?
72,The campus movie screening drew a huge audience.,Make an appropriate sentence.,How can we find ____ ____ ____ ____ ____ ____ ____?,out|when|another|screening|is|happening|soon,happening|soon|is|really|when|today|out|screening|another,medium,find_out_when,How can we find out when another screening is happening soon?
73,The robotics demo was more exciting than I expected.,Make an appropriate sentence.,How can we find out ____ ____ ____ ____ ____ ____ ____?,when|the|next|demo|is|taking|place,when|place|is|really|taking|the|next|demo,medium,find_out_when,How can we find out when the next demo is taking place?
74,The design workshop gave me lots of ideas.,Make an appropriate sentence.,How can we find out ____ ____ ____ ____ ____ ____ ____?,when|a|similar|workshop|is|happening|again,happening|similar|a|is|workshop|when|really|again,medium,find_out_when,How can we find out when a similar workshop is happening again?
75,The poetry reading at the café was surprisingly good.,Make an appropriate sentence.,How can we find ____ ____ ____ ____ ____ ____ ____?,out|when|another|reading|is|scheduled|there,when|really|scheduled|is|reading|out|another|there,medium,find_out_when,How can we find out when another reading is scheduled there?
76,The community market had so many local artists.,Make an appropriate sentence.,How can we find out ____ ____ ____ ____ ____ ____ ____?,when|the|next|market|is|being|held,being|really|market|is|the|next|held|today|when,medium,find_out_when,How can we find out when the next market is being held?
77,The volunteer orientation was very helpful.,Make an appropriate sentence.,How can we find out ____ ____ ____ ____ ____ ____ ____?,when|the|next|session|is|taking|place,when|the|place|session|is|really|taking|next,medium,find_out_when,How can we find out when the next session is taking place?
78,The language exchange night was fun and relaxed.,Make an appropriate sentence.,How can we find ____ ____ ____ ____ ____ ____ ____?,out|when|another|meeting|is|happening|again,really|another|is|out|again|when|happening|meeting|today,medium,find_out_when,How can we find out when another meeting is happening again?
79,The film discussion after class was really engaging.,Make an appropriate sentence.,How can we find ____ ____ ____ ____ ____ ____ ____?,out|when|the|next|discussion|is|scheduled,out|scheduled|really|today|next|when|is|the|discussion,medium,find_out_when,How can we find out when the next discussion is scheduled?
80,That museum lecture on ancient history was fascinating.,Make an appropriate sentence.,How can we find out ____ ____ ____ ____ ____ ____ ____?,when|a|similar|talk|is|happening|again,again|is|today|really|similar|happening|talk|when|a,medium,find_out_when,How can we find out when a similar talk is happening again?
81,I am looking for winter volunteer opportunities.,Make an appropriate sentence.,Which organizations in ____ ____ ____ ____ ____ ____ ____?,your|city|are|you|planning|to|contact,city|planning|you|really|are|your|to|contact,medium,which_contact,Which organizations in your city are you planning to contact?
82,I want to help at a food bank this month.,Make an appropriate sentence.,Which groups in ____ ____ ____ ____ ____ ____ ____?,the|area|are|you|planning|to|contact,the|really|to|contact|you|are|planning|area,medium,which_contact,Which groups in the area are you planning to contact?
83,I hope to volunteer at an animal shelter soon.,Make an appropriate sentence.,Which places ____ ____ ____ ____ ____ ____ ____?,near|campus|are|you|planning|to|contact,to|contact|you|planning|today|are|campus|near|really,medium,which_contact,Which places near campus are you planning to contact?
84,I need community service hours before graduation.,Make an appropriate sentence.,Which ____ ____ ____ ____ ____ ____ ____?,programs|downtown|are|you|planning|to|contact,you|contact|planning|to|really|programs|downtown|today|are,medium,which_contact,Which programs downtown are you planning to contact?
85,I would like to tutor children on weekends.,Make an appropriate sentence.,Which centers ____ ____ ____ ____ ____ ____ ____?,in|town|are|you|planning|to|contact,really|town|contact|to|you|planning|are|in,medium,which_contact,Which centers in town are you planning to contact?
86,I want to join an environmental project this spring.,Make an appropriate sentence.,Which teams in ____ ____ ____ ____ ____ ____ ____?,the|city|are|you|planning|to|contact,are|to|the|city|really|you|planning|contact,medium,which_contact,Which teams in the city are you planning to contact?
87,I am interested in helping at a hospital.,Make an appropriate sentence.,Which offices ____ ____ ____ ____ ____ ____ ____?,near|here|are|you|planning|to|contact,near|are|planning|here|to|you|contact|really,medium,which_contact,Which offices near here are you planning to contact?
88,I want to work with elderly residents this summer.,Make an appropriate sentence.,Which homes in ____ ____ ____ ____ ____ ____ ____?,the|district|are|you|planning|to|contact,district|really|you|the|contact|planning|are|to,medium,which_contact,Which homes in the district are you planning to contact?
89,I am searching for museum volunteer roles.,Make an appropriate sentence.,Which museums ____ ____ ____ ____ ____ ____ ____?,in|town|are|you|planning|to|contact,to|today|in|town|planning|are|really|contact|you,medium,which_contact,Which museums in town are you planning to contact?
90,I would like to mentor younger students after school.,Make an appropriate sentence.,Which schools ____ ____ ____ ____ ____ ____ ____?,near|you|are|you|planning|to|contact,are|you|near|you|to|planning|really|contact,medium,which_contact,Which schools near you are you planning to contact?
